Product ID,Title,Vendor,Product Type,Price,Compare Price,SKU,Barcode,Inventory,Weight (g),Tags,Handle,Status
15167717933404,"- Detersivo bici","Muc-Off","Teile > Velopflege",9.90,,"","5037835371000",0,0.0,"bicycle, bike, imported-2025-08-07, imported-ecom, Muc-Off, Teile, traditional, Velopflege","detersivo-bici",active
15167721701724,"- Helme Sutton MIPS Matt Warm Black","Giro Cycling","Zubehör > Helme > Urban",89.30,149.00,"","768686380624",1,0.0,"Giro Cycling, Helme, helmet, imported-2025-08-07, imported-ecom, protection, safety, Zubehör","helme-sutton-mips-matt-warm-black",active
15167711936860,"-Guanto DND Adult - Nero","Giro Cycling","Zubehör > Bekleidung > Handschuhe",18.00,39.00,"","768686022463",1,0.0,"apparel, Bekleidung, clothing, gear, Giro Cycling, imported-2025-08-07, imported-ecom, Zubehör","guanto-dnd-adult-nero",active
15167705874780,"0;5l black","CUBE","Zubehör > Trinkflaschen",7.90,,"13034","4250589419366",0,51.0,"accessory, bottle, CUBE, hydration, imported-2025-08-07, imported-ecom, Trinkflaschen, Zubehör","05l-black",active
15167703646556,"0;5l trasparente","CUBE","Zubehör > Trinkflaschen",5.90,,"13033","4250589419359",0,51.0,"accessory, bottle, CUBE, hydration, imported-2025-08-07, imported-ecom, Trinkflaschen, Zubehör","05l-trasparente",active
15167753945436,"100% - Guanti brisker gialli XL","100%","Zubehör > Bekleidung > Handschuhe",20.00,,"","841269184243",1,0.0,"100%, apparel, Bekleidung, clothing, gear, imported-2025-08-07, imported-ecom, Zubehör","100-guanti-brisker-gialli-xl",active
15167714918748,"164 Halte-Schelle zu IQ X Farbe: SCHWARZ","Busch+Müller","Teile",9.90,,"313049.03","4006021012059",9,0.0,"accessory, Busch+Müller, imported-2025-08-07, imported-ecom, Teile","164-halte-schelle-zu-iq-x-farbe-schwarz",active
15167749194076,"200 hour/1 year Service Kit, Recon RL/TK A1 (2018+) - Kit manutenzione forcella","Rockshox","Teile > Dämpfer & Federgabel",22.00,,"00.4315.032.650","710845808289",2,0.0,"accessory, Dämpfer & Federgabel, imported-2025-08-07, imported-ecom, Rockshox, Teile","200-hour1-year-service-kit-recon-rltk-a1-2018-kit-manutenzione-forcella",active
15167748997468,"3 x Brush Set","Muc-Off","Zubehör > Tools",29.90,34.90,"","5037835220001",0,0.0,"imported-2025-08-07, imported-ecom, maintenance, Muc-Off, repair, tool, Tools, Zubehör","3-x-brush-set",active
15167723209052,"40 komplettes Headset ZS44/28.6 ZS56/30","CANE CREEK","Teile > Lenker",69.90,79.90,"","840226077413",0,0.0,"accessory, CANE CREEK, imported-2025-08-07, imported-ecom, Lenker, Teile","40-komplettes-headset-zs44286-zs5630",active
15167766626652,"46er Sideloader Set","Benno","Zubehör > Kindersitz",175.00,219.90,"A2003","810076250205",0,0.0,"accessory, baby-seat, Benno, child-seat, family, imported-2025-08-07, imported-ecom, Kindersitz, Zubehör","46er-sideloader-set",active
15167761318236,"606 EBIKE 6-48 VOLT","AXA","Zubehör > Lichte",21.99,,"LAA078","8713249282909",2,0.0,"AXA, imported-2025-08-07, imported-ecom, lamp, Lichte, light, safety, visibility, Zubehör","606-ebike-6-48-volt",active
15167752438108,"A-Head stem ST-M15 XLC Comp A-head stem ST-M15, black, 35°, 1 1/8"", Ø 25.4mm, 60mm","GODSPEED ebike","Teile > Lenker",26.01,,"2501535900","4032191794563",0,0.0,"accessory, godspeed-ebike, imported-2025-08-07, imported-ecom, Lenker, Teile","a-head-stem-st-m15-xlc-comp-a-head-stem-st-m15-black-35-1-18-254mm-60mm",active
15167786090844,"Abus Catena ad anello  2.0 6KS/100 con borsa sottosella ST5950 nero","ABUS","Zubehör > Schlösser",69.00,,"11.88222","4003318953637",1,0.0,"ABUS, anti-theft, imported-2025-08-07, imported-ecom, lock, Schlösser, security, Zubehör","abus-catena-ad-anello-20-6ks100-con-borsa-sottosella-st5950-nero",active
15167779995996,"Abus Catena IVY 6KS/100 con custodia ST5950 nero","ABUS","Zubehör > Schlösser",75.00,,"11.82866","4003318690556",0,0.0,"ABUS, anti-theft, imported-2025-08-07, imported-ecom, lock, Schlösser, security, Zubehör","abus-catena-ivy-6ks100-con-custodia-st5950-nero",active
15167761482076,"Abus cilindro batteria DT2 YourPlus","ABUS","Teile > Bosch",54.00,,"","4003318814792",0,0.0,"ABUS, accessory, Bosch, e-bike, electric, imported-2025-08-07, imported-ecom, Teile","abus-cilindro-batteria-dt2-yourplus",active
15167779537244,"Abus Schlaufenkette Adaptor Chain 2.0 6KS/100 schwarz","ABUS","Zubehör > Schlösser",49.90,,"11.88221","4003318953606",0,0.0,"ABUS, anti-theft, imported-2025-08-07, imported-ecom, lock, Schlösser, security, Zubehör","abus-schlaufenkette-adaptor-chain-20-6ks100-schwarz",active
15167761580380,"Achsadapter Thule Syntace X-12 (M12x1.0)  160 - 180 mm","THULE","Teile > Räder",69.76,,"3092060000","0872299038541",5,0.0,"accessory, imported-2025-08-07, imported-ecom, Räder, Teile, THULE","achsadapter-thule-syntace-x-12-m12x10-160-180-mm",active
15167763448156,"Achse komplett WH-RS11-R 141 mm (5-6/16"")","SHIMANO","Teile > Räder",24.00,,"Y49998180","4524667394464",0,0.0,"accessory, imported-2025-08-07, imported-ecom, Räder, SHIMANO, Teile","achse-komplett-wh-rs11-r-141-mm-5-616",active
15167763415388,"Achse komplett zu Hinterrad WH-R501-R 141mm","SHIMANO","Teile > Räder",28.80,,"Y4SK98030","4524667983927",1,0.0,"accessory, imported-2025-08-07, imported-ecom, Räder, SHIMANO, Teile","achse-komplett-zu-hinterrad-wh-r501-r-141mm",active
15167773606236,"ACID - Pannier Bag PRO 20/2 SMLink","ACID","Zubehör > Velotaschen",119.90,139.90,"93101","4054571157010",3,2.0,"ACID, bag, imported-2025-08-07, imported-ecom, pannier, storage, Velotaschen, Zubehör","acid-pannier-bag-pro-202-smlink",active
15167755419996,"ACID - Pedivelle TREKKING HYBRID - 165mm","ACID","Teile > Pedale",64.90,,"93280","4054571201393",3,0.0,"accessory, ACID, imported-2025-08-07, imported-ecom, Pedale, Teile","acid-pedivelle-trekking-hybrid-165mm",active
15167772852572,"ACID Bell ALPHA 22,2","ACID","Zubehör > Klingeln",16.90,,"93340","4054571155672",2,0.0,"accessory, ACID, imported-2025-08-07, imported-ecom, Klingeln, Zubehör","acid-bell-alpha-222",active
15167787663708,"ACID Bike Chain Oil Pro 50ml","ACID","Zubehör > Werkstatt / Werkzeuge",6.90,,"93422","4054571163950",9,0.0,"ACID, imported-2025-08-07, imported-ecom, maintenance, repair, tool, Werkstatt / Werkzeuge, workshop, Zubehör","acid-bike-chain-oil-pro-50ml",active
15167787598172,"ACID Bike Chain Spray 300ml","ACID","Zubehör > Werkstatt / Werkzeuge",14.90,,"93421","4054571163943",9,0.0,"ACID, imported-2025-08-07, imported-ecom, maintenance, repair, tool, Werkstatt / Werkzeuge, workshop, Zubehör","acid-bike-chain-spray-300ml",active
15167786811740,"ACID Bike Drivetrain Cleaner 300ml","ACID","Zubehör > Werkstatt / Werkzeuge",14.90,,"93426","4054571164018",9,0.0,"ACID, imported-2025-08-07, imported-ecom, maintenance, repair, tool, Werkstatt / Werkzeuge, workshop, Zubehör","acid-bike-drivetrain-cleaner-300ml",active
15167787630940,"ACID Bike Frame Protection 300ml","ACID","Zubehör > Werkstatt / Werkzeuge",14.90,,"93427","4054571164025",5,0.0,"ACID, imported-2025-08-07, imported-ecom, maintenance, repair, tool, Werkstatt / Werkzeuge, workshop, Zubehör","acid-bike-frame-protection-300ml",active
15167767544156,"ACID Carrier Basket 30 Trunk RILink 2.0","ACID","Zubehör > Körbe",39.90,44.90,"93359","4054571163882",16,2.0,"accessory, ACID, basket, carrier, imported-2025-08-07, imported-ecom, Körbe, storage, Zubehör","acid-carrier-basket-30-trunk-rilink-20",active
15167770362204,"ACID Carrier GRAVEL","ACID","Zubehör > Gepäckträger",54.90,,"93395","4054571186386",0,0.0,"ACID, adventure, carrier, Gepäckträger, gravel, imported-2025-08-07, imported-ecom, luggage, rack, Zubehör","acid-carrier-gravel",active
15167772983644,"ACID Carrier SIC 28"" RILink","ACID","Zubehör > Gepäckträger",64.90,,"92048","4250589488089",0,0.0,"ACID, carrier, Gepäckträger, imported-2025-08-07, imported-ecom, luggage, rack, Zubehör","acid-carrier-sic-28-rilink",active
15167773442396,"ACID Carrier SIC RAIL 28""","ACID","Zubehör > Gepäckträger",49.90,54.90,"94806","4054571167910",0,0.0,"ACID, carrier, Gepäckträger, imported-2025-08-07, imported-ecom, luggage, rack, Zubehör","acid-carrier-sic-rail-28",active
15167776719196,"ACID Chain Lock CORVID PRO K120","ACID","Zubehör > Schlösser",59.90,,"13309","4054571182890",0,0.0,"ACID, anti-theft, imported-2025-08-07, imported-ecom, lock, Schlösser, security, Zubehör","acid-chain-lock-corvid-pro-k120",active
15167781568860,"ACID Chainguard IC 3.0 Hybrid Trekking","ACID","Teile > Getriebe und Übersetzung",16.90,,"93537","4054571237705",3,0.0,"accessory, ACID, Getriebe und Übersetzung, imported-2025-08-07, imported-ecom, Teile","acid-chainguard-ic-30-hybrid-trekking",active
15167781601628,"ACID Chainguard IC 3.0 Hybrid Trekking Mounting Plate","ACID","Teile > Getriebe und Übersetzung",3.50,,"93538","4054571237712",4,0.0,"accessory, ACID, Getriebe und Übersetzung, imported-2025-08-07, imported-ecom, Teile","acid-chainguard-ic-30-hybrid-trekking-mounting-plate",active
15167778259292,"ACID Disc Brake Pad Avid Elixir Trail X0/X9/X7, SRAM Guide R Organic","ACID","Teile > Bremsen",18.90,,"93649","4054571164292",10,0.0,"accessory, ACID, Bremsen, disc-brake, imported-2025-08-07, imported-ecom, sram, Teile","acid-disc-brake-pad-avid-elixir-trail-x0x9x7-sram-guide-r-organic",active
15167776751964,"ACID Disc Brake Pad Shimano Deore BR-M505/515/525/445/446 MT200/400","ACID","Teile > Bremsen",18.90,,"2407","4054571164193",105,0.0,"accessory, ACID, Bremsen, disc-brake, imported-2025-08-07, imported-ecom, shimano, Teile","acid-disc-brake-pad-shimano-deore-br-m505515525445446-mt200400",active
15167776817500,"ACID Disc Brake Pad Shimano Saint BR-M820/810, Zee BR-M640, BR-M8020, MT520","ACID","Teile > Bremsen",21.90,,"93642","4054571164223",12,0.0,"accessory, ACID, Bremsen, disc-brake, imported-2025-08-07, imported-ecom, shimano, Teile","acid-disc-brake-pad-shimano-saint-br-m820810-zee-br-m640-br-m8020-mt520",active
15167776915804,"ACID Disc Brake Pad Shimano Saint BR-M820/810, Zee BR-M640, BR-M8020, MT520 Organic","ACID","Teile > Bremsen",18.90,,"93643","4054571164230",45,0.0,"accessory, ACID, Bremsen, disc-brake, imported-2025-08-07, imported-ecom, shimano, Teile","acid-disc-brake-pad-shimano-saint-br-m820810-zee-br-m640-br-m8020-mt520-organic",active
15167771443548,"ACID E-Bike Front Light PRO-E 140 High Beam BES3","ACID","Zubehör > Lichte",159.90,,"93812","4054571222114",0,0.0,"ACID, imported-2025-08-07, imported-ecom, lamp, Lichte, light, safety, visibility, Zubehör","acid-e-bike-front-light-pro-e-140-high-beam-bes3",active
15167781437788,"ACID E-Bike Front Light PRO-E 60 CMPT BES3","ACID","Zubehör > Lichte",34.90,,"93814","4054571222138",4,0.0,"ACID, imported-2025-08-07, imported-ecom, lamp, Lichte, light, safety, visibility, Zubehör","acid-e-bike-front-light-pro-e-60-cmpt-bes3",active
15167782486364,"ACID E-Bike Frontlicht PRO-E 60 CMPT X-Connect","ACID","Zubehör > Lichte",34.90,,"94891","4054571168535",9,0.0,"ACID, imported-2025-08-07, imported-ecom, lamp, Lichte, light, safety, visibility, Zubehör","acid-e-bike-frontlicht-pro-e-60-cmpt-x-connect",active
15167731204444,"ACID E-Bike Schutzblechrücklicht PRO-E (12V) BES3","ACID","Zubehör > Lichte",14.90,21.90,"93815","4054571222145",51,0.0,"ACID, imported-2025-08-07, imported-ecom, lamp, Lichte, light, safety, visibility, Zubehör","acid-e-bike-schutzblechruecklicht-pro-e-12v-bes3",active
15167783633244,"ACID Einteiliger Bremsschuh V-Brake","ACID","Teile > Bremsen",5.90,7.50,"93659","4054571164391",8,0.0,"accessory, ACID, Bremsen, imported-2025-08-07, imported-ecom, Teile","acid-einteiliger-bremsschuh-v-brake",active
15167782945116,"ACID Fahrradständer CM ROOKIE EASY M","ACID","Zubehör > Ständer",9.90,10.90,"98316","4054571168337",0,0.0,"ACID, imported-2025-08-07, imported-ecom, kickstand, parking, stand, Ständer, Zubehör","acid-fahrradstaender-cm-rookie-easy-m",active
15167769870684,"ACID Fahrradständer FM PRO","ACID","Zubehör > Ständer",39.90,,"93469","4054571188076",22,0.0,"ACID, imported-2025-08-07, imported-ecom, kickstand, parking, stand, Ständer, Zubehör","acid-fahrradstaender-fm-pro",active
15167780618588,"ACID Fahrradständer FM ROOKIE EASY M","ACID","Zubehör > Ständer",13.90,16.90,"98314","4054571168313",2,0.0,"ACID, imported-2025-08-07, imported-ecom, kickstand, parking, stand, Ständer, Zubehör","acid-fahrradstaender-fm-rookie-easy-m",active
15167778619740,"ACID Fahrradständer FM ROOKIE EASY S","ACID","Zubehör > Ständer",12.90,16.90,"98313","4054571168306",14,0.0,"ACID, imported-2025-08-07, imported-ecom, kickstand, parking, stand, Ständer, Zubehör","acid-fahrradstaender-fm-rookie-easy-s",active
15167712166236,"ACID Fahrradständer UNIVERSAL Kettenstrebe","ACID","Zubehör > Ständer",16.90,24.90,"92040","4054571144782",30,0.0,"ACID, imported-2025-08-07, imported-ecom, kickstand, parking, stand, Ständer, Zubehör","acid-fahrradstaender-universal-kettenstrebe",active
15167783240028,"ACID Faltschloss RIGID PURE C120 black 1200mm","ACID","Zubehör > Schlösser",79.90,89.90,"93515","4054571237422",3,0.0,"ACID, anti-theft, imported-2025-08-07, imported-ecom, lock, Schlösser, security, Zubehör","acid-faltschloss-rigid-pure-c120-black-1200mm",active
15167744737628,"ACID Faltschloss RIGID PURE K120","ACID","Zubehör > Schlösser",79.90,89.90,"93352","4054571151551",6,1.0,"ACID, anti-theft, imported-2025-08-07, imported-ecom, lock, Schlösser, security, Zubehör","acid-faltschloss-rigid-pure-k120",active
15167763546460,"ACID Flaschenhalter HPP matt black´n´glossy black","ACID","Zubehör > Trinkflaschen",14.90,18.90,"93326","4054571143082",0,0.0,"accessory, ACID, bottle, hydration, imported-2025-08-07, imported-ecom, Trinkflaschen, Zubehör","acid-flaschenhalter-hpp-matt-blacknglossy-black",active
15167783272796,"ACID Folding Lock RIGID PURE C100 black 1000mm","ACID","Zubehör > Schlösser",69.90,74.90,"93514","4054571237415",14,0.0,"ACID, anti-theft, compact, folding, imported-2025-08-07, imported-ecom, lock, Schlösser, security, Zubehör","acid-folding-lock-rigid-pure-c100-black-1000mm",active
15167763579228,"ACID Frame Mount STASH for Tool HUSK","ACID","Zubehör",5.50,,"93887","4054571190697",0,0.0,"accessory, ACID, imported-2025-08-07, imported-ecom, Zubehör","acid-frame-mount-stash-for-tool-husk",active
15167778193756,"ACID Front Carrier COMPACT 20""","ACID","Zubehör > Gepäckträger",34.90,44.90,"93151","4054571181251",5,1.0,"ACID, carrier, Gepäckträger, imported-2025-08-07, imported-ecom, luggage, rack, Zubehör","acid-front-carrier-compact-20",active
15167707382108,"ACID Gepäckträgerkorb 20 RILink Rattan","ACID","Zubehör > Körbe",39.90,54.90,"93125","4250589485682",11,2.0,"accessory, ACID, basket, carrier, imported-2025-08-07, imported-ecom, Körbe, storage, Zubehör","acid-gepaecktraegerkorb-20-rilink-rattan",active
15167771836764,"ACID Gepäckträgerkorb 25 RILink","ACID","Zubehör > Körbe",44.90,44.90,"93122","4250589485651",10,2.0,"accessory, ACID, basket, carrier, imported-2025-08-07, imported-ecom, Körbe, storage, Zubehör","acid-gepaecktraegerkorb-25-rilink",active
15167783666012,"ACID Gepäckträgerkorb 25 RILink Rattan","ACID","Zubehör > Körbe",49.90,54.90,"93123","4250589485668",0,2.0,"accessory, ACID, basket, carrier, imported-2025-08-07, imported-ecom, Körbe, storage, Zubehör","acid-gepaecktraegerkorb-25-rilink-rattan",active
15167787041116,"ACID Grips DISRUPT Black 30.5mm","ACID","Teile > Griffe",26.90,,"11581","4054571190611",1,0.0,"accessory, ACID, Griffe, imported-2025-08-07, imported-ecom, Teile","acid-grips-disrupt-black-305mm",active
15167772393820,"ACID Grips ICON PRO","ACID","Teile > Griffe",16.90,,"94781","4054571190468",-1,0.0,"accessory, ACID, Griffe, imported-2025-08-07, imported-ecom, Teile","acid-grips-icon-pro",active
15167778095452,"ACID Grips ICON PRO Orange","ACID","Teile > Griffe",12.90,16.90,"94787","4054571230188",0,0.0,"accessory, ACID, Griffe, imported-2025-08-07, imported-ecom, Teile","acid-grips-icon-pro-orange",active
15167786582364,"ACID Grips KIDS 16.0 with Bumper","ACID","Teile > Griffe",10.90,,"13123","4054571186461",0,0.0,"accessory, ACID, Griffe, imported-2025-08-07, imported-ecom, Teile","acid-grips-kids-160-with-bumper",active
15167718555996,"ACID Handlebar Mount for KIOX","ACID","Zubehör",6.50,,"93071","4250589488201",0,0.0,"accessory, ACID, imported-2025-08-07, imported-ecom, Zubehör","acid-handlebar-mount-for-kiox",active
15167748243804,"ACID Kabelschloss CORVID C180 black 12 x 1800 mm","ACID","Zubehör > Schlösser",21.90,,"13327","4250589499818",1,0.0,"ACID, anti-theft, imported-2025-08-07, imported-ecom, lock, Schlösser, security, Zubehör","acid-kabelschloss-corvid-c180-black-12-x-1800-mm",active
15167782420828,"ACID Kabelschloss CORVID K180 black 12 x 1800mm","ACID","Zubehör > Schlösser",21.90,,"13333","4250589483527",1,1.0,"ACID, anti-theft, imported-2025-08-07, imported-ecom, lock, Schlösser, security, Zubehör","acid-kabelschloss-corvid-k180-black-12-x-1800mm",active
15167776653660,"ACID Kettenschloss CORVID PRO C120 6 x 1200 mm","ACID","Zubehör > Schlösser",59.90,,"13308","4054571182906",0,0.0,"ACID, anti-theft, imported-2025-08-07, imported-ecom, lock, Schlösser, security, Zubehör","acid-kettenschloss-corvid-pro-c120-6-x-1200-mm",active
15167769379164,"ACID Kettenschloss SOLID K120","ACID","Zubehör > Schlösser",59.90,64.90,"93732","4054571240071",0,0.0,"ACID, anti-theft, imported-2025-08-07, imported-ecom, lock, Schlösser, security, Zubehör","acid-kettenschloss-solid-k120",active
15167739691356,"ACID Kettenschutz IC 3.0 Hybrid Tiefeinsteiger Montageplatte","ACID","Teile > Getriebe und Übersetzung",3.50,,"93524","4054571237699",6,0.0,"accessory, ACID, Getriebe und Übersetzung, imported-2025-08-07, imported-ecom, Teile","acid-kettenschutz-ic-30-hybrid-tiefeinsteiger-montageplatte",active
15167755452764,"ACID Kurbel TREKKING HYBRID (ISIS / GEN4) - 170mm","ACID","Teile > Pedale",44.90,,"93292","4054571159540",0,1.0,"accessory, ACID, imported-2025-08-07, imported-ecom, Pedale, Teile","acid-kurbel-trekking-hybrid-isis-gen4-170mm",active
15167763743068,"ACID Kurbel TREKKING HYBRID (ISIS / GEN4) - 175mm","ACID","Teile > Pedale",44.90,,"93292","4054571159557",1,0.0,"accessory, ACID, imported-2025-08-07, imported-ecom, Pedale, Teile","acid-kurbel-trekking-hybrid-isis-gen4-175mm",active
15167709446492,"ACID Lenkerkorb 16 FILink Rattan","ACID","Zubehör > Körbe",54.90,54.90,"93121","4250589485644",0,0.0,"accessory, ACID, basket, carrier, imported-2025-08-07, imported-ecom, Körbe, storage, Zubehör","acid-lenkerkorb-16-filink-rattan",active
15167782551900,"ACID Lichtadapter FPILink Universal Clip","ACID","Zubehör > Lichte",6.90,7.50,"93698","4054571239471",7,0.0,"ACID, imported-2025-08-07, imported-ecom, lamp, Lichte, light, safety, visibility, Zubehör","acid-lichtadapter-fpilink-universal-clip",active
15167777800540,"ACID Light Set PRO 100","ACID","Zubehör > Lichte",59.90,74.90,"93531","4054571176400",49,0.0,"ACID, imported-2025-08-07, imported-ecom, lamp, Lichte, light, safety, visibility, Zubehör","acid-light-set-pro-100",active
15167755911516,"ACID Light Set PRO 20 CMPT","ACID","Zubehör > Lichte",19.90,21.90,"93306","4054571156945",22,1.0,"ACID, imported-2025-08-07, imported-ecom, lamp, Lichte, light, safety, visibility, Zubehör","acid-light-set-pro-20-cmpt",active
15167782879580,"ACID Natural Bike Antriebsreiniger 500ml","ACID","Zubehör > Werkstatt / Werkzeuge",12.90,,"92350","4054571192905",15,1.0,"ACID, imported-2025-08-07, imported-ecom, maintenance, repair, tool, Werkstatt / Werkzeuge, workshop, Zubehör","acid-natural-bike-antriebsreiniger-500ml",active
15167779471708,"ACID Natural Bike Chain Oil 100ml","ACID","Zubehör > Werkstatt / Werkzeuge",12.90,,"92352","4054571192929",11,1.0,"ACID, imported-2025-08-07, imported-ecom, maintenance, repair, tool, Werkstatt / Werkzeuge, workshop, Zubehör","acid-natural-bike-chain-oil-100ml",active
15167773573468,"ACID Pannier Bag PURE 20/2 SMLink","ACID","Zubehör > Velotaschen",99.90,109.90,"93107","4054571157959",1,2.0,"ACID, bag, imported-2025-08-07, imported-ecom, pannier, storage, Velotaschen, Zubehör","acid-pannier-bag-pure-202-smlink",active
15167776883036,"Acid Pastiglie freno Magura MT5 Organic","ACID","Teile > Bremsen",18.90,,"93651","4054571164315",2,0.0,"accessory, ACID, Bremsen, imported-2025-08-07, imported-ecom, Teile","acid-pastiglie-freno-magura-mt5-organic",active
15167786975580,"ACID Pedals FLAT A2-IB Black","ACID","Teile > Pedale",74.90,,"93254","4054571161123",5,0.0,"accessory, ACID, imported-2025-08-07, imported-ecom, Pedale, Teile","acid-pedals-flat-a2-ib-black",active
15167778488668,"ACID Pedals FLAT A2-IB Hybrid R - black","ACID","Teile > Pedale",49.90,64.90,"92420","4054571164636",2,1.0,"accessory, ACID, imported-2025-08-07, imported-ecom, Pedale, Teile","acid-pedals-flat-a2-ib-hybrid-r-black",active
15167778455900,"ACID Pedals FLAT A3-ZP R - oil slick","ACID","Teile > Pedale",54.90,,"92408","4054571164513",0,0.0,"accessory, ACID, imported-2025-08-07, imported-ecom, Pedale, Teile","acid-pedals-flat-a3-zp-r-oil-slick",active
15167778423132,"ACID Pedals FLAT A3-ZP R - Yellow","ACID","Teile > Pedale",44.90,,"92406","4054571164490",2,0.0,"accessory, ACID, imported-2025-08-07, imported-ecom, Pedale, Teile","acid-pedals-flat-a3-zp-r-yellow",active
15167782846812,"ACID Pumpe RACE MICRO CMPT","ACID","Zubehör > Pumpen",10.90,,"93010","4054571167811",2,0.0,"ACID, imported-2025-08-07, imported-ecom, inflation, pump, Pumpen, tool, Zubehör","acid-pumpe-race-micro-cmpt",active
15167744901468,"ACID Rear Light Cable for BOSCH 1400m BES2","Bosch","Zubehör > Werkstatt / Werkzeuge",7.90,10.90,"93713","4054571189462",62,0.0,"Bosch, e-bike, electric, imported-2025-08-07, imported-ecom, maintenance, repair, tool, Werkstatt / Werkzeuge, workshop, Zubehör","acid-rear-light-cable-for-bosch-1400m-bes2",active
15167778586972,"ACID Saddle NUANCE GRAVEL","ACID","Teile > Sattel",74.90,,"94849","4054571230638",0,0.0,"accessory, ACID, adventure, gravel, imported-2025-08-07, imported-ecom, Sattel, Teile","acid-saddle-nuance-gravel",active
15167778554204,"ACID Sattelstützen Reduzierhülse 27.2 / 30.09 mm","ACID","Teile > Sattelstütze",8.90,,"93861","4054571238108",12,0.0,"accessory, ACID, imported-2025-08-07, imported-ecom, Sattelstütze, Teile","acid-sattelstuetzen-reduzierhuelse-272-3009-mm",active
15167778521436,"ACID Scheibenbremsbelag Magura MT-2-4-6-8","ACID","Teile > Bremsen",18.90,,"93645","4054571164254",1,0.0,"accessory, ACID, Bremsen, imported-2025-08-07, imported-ecom, Teile","acid-scheibenbremsbelag-magura-mt-2-4-6-8",active
15167739789660,"ACID Schlauch 29"" MTB SV 40mm (Werkstattverpackung VPE 50)","ACID","Teile > Räder",7.50,,"93701","4054571189547",0,0.0,"accessory, ACID, imported-2025-08-07, imported-ecom, Räder, Teile","acid-schlauch-29-mtb-sv-40mm-werkstattverpackung-vpe-50",active
15167763087708,"ACID Schutzblechset 56 28"" BB Mount 2.0","ACID","Zubehör > Schutzbleche",44.90,,"93467","4054571188052",1,1.0,"ACID, fender, imported-2025-08-07, imported-ecom, mudguard, protection, Schutzbleche, Zubehör","acid-schutzblechset-56-28-bb-mount-20",active
15167725470044,"ACID Schutzblechset 75 27,5"" 2.0","ACID","Zubehör > Schutzbleche",35.90,44.90,"93376","4054571184634",7,1.0,"ACID, fender, imported-2025-08-07, imported-ecom, mudguard, protection, Schutzbleche, Zubehör","acid-schutzblechset-75-275-20",active
15167772197212,"ACID Schutzblechset Nuroad Hybrid 60 28"" BB Mount 2.0","ACID","Zubehör > Schutzbleche",35.92,44.90,"93998","4054571190888",9,1.0,"ACID, fender, imported-2025-08-07, imported-ecom, mudguard, protection, racing, road, Schutzbleche, Zubehör","acid-schutzblechset-nuroad-hybrid-60-28-bb-mount-20",active
15167755747676,"ACID Seatpost Adapter 27,2 / 31,6 mm","ACID","Teile > Sattelstütze",8.90,10.90,"93861","4054571238412",15,0.0,"accessory, ACID, imported-2025-08-07, imported-ecom, Sattelstütze, Teile","acid-seatpost-adapter-272-316-mm",active
15167784354140,"ACID Seitentasche PRO 15 CILink","ACID","Zubehör > Velotaschen",74.90,,"93275","4054571191113",18,0.0,"ACID, bag, imported-2025-08-07, imported-ecom, pannier, storage, Velotaschen, Zubehör","acid-seitentasche-pro-15-cilink",active
15167784321372,"ACID Seitentasche PRO 20/2 CILink","ACID","Zubehör > Velotaschen",139.90,,"93276","4054571191120",12,0.0,"ACID, bag, imported-2025-08-07, imported-ecom, pannier, storage, Velotaschen, Zubehör","acid-seitentasche-pro-202-cilink",active
15167784386908,"ACID Seitentasche PURE 15 CILink","ACID","Zubehör > Velotaschen",54.90,,"93278","4054571191144",5,0.0,"ACID, bag, imported-2025-08-07, imported-ecom, pannier, storage, Velotaschen, Zubehör","acid-seitentasche-pure-15-cilink",active
15167784255836,"ACID Seitentasche PURE 20/2 CILink","ACID","Zubehör > Velotaschen",99.90,,"93279","4054571191151",4,0.0,"ACID, bag, imported-2025-08-07, imported-ecom, pannier, storage, Velotaschen, Zubehör","acid-seitentasche-pure-202-cilink",active
15167755321692,"ACID SMLink - attacco borsa","ACID","Zubehör > Velotaschen",10.90,,"93037","4054571239457",0,0.0,"ACID, bag, imported-2025-08-07, imported-ecom, pannier, storage, Velotaschen, Zubehör","acid-smlink-attacco-borsa",active
15167771771228,"ACID Spiegel PRO","ACID","Zubehör > Spiegel",29.95,34.90,"93546","4054571237729",16,0.0,"accessory, ACID, imported-2025-08-07, imported-ecom, Spiegel, Zubehör","acid-spiegel-pro",active
15167763644764,"ACID Steckachse M12x1.0 142-148 mm für Fahrradanhänger","ACID","Zubehör > Anhänger",39.90,44.90,"94779","4054571224637",8,0.0,"ACID, Anhänger, cargo, imported-2025-08-07, imported-ecom, trailer, transport, Zubehör","acid-steckachse-m12x10-142-148-mm-fuer-fahrradanhaenger",active
15167770493276,"ACID Tube 27,5"" MTB Downhill SV 40mm","ACID","Teile > Räder",10.90,,"93586","4054571189523",-1,0.0,"accessory, ACID, imported-2025-08-07, imported-ecom, Räder, Teile","acid-tube-275-mtb-downhill-sv-40mm",active
